[{"contractVersion":"candidate-source-v1","taskId":"TEST_FIXTURE_TASK_001","executionId":"TEST_FIXTURE_EXECUTION_001","sourceId":"d5de69370b7149be1cd81da0a204e6b32df3433f92376bbac3c805b562d946d5","sourceUrl":"https://example.com/test-fixture/no-signal?utm_source=test","canonicalUrl":"https://example.com/test-fixture/no-signal","sourcePlatform":"example_fixture","pageTitle":"TEST_FIXTURE no signal page","sellerName":null,"productTitle":"Synthetic product","price":100,"currency":"TRY","country":"TR","city":null,"searchQuery":null,"acquisitionMethod":"manual_seed","discoveredAt":"2026-07-18T00:00:00.000Z","acquisitionStatus":"acquired","legalBasis":"public_source","robotsPolicy":"allowed","errorCode":null,"fixtureMetadata":{"marker":"TEST_FIXTURE","isTestFixture":true,"productionEligible":false,"scenario":"no_signal"}}]
