[{"contractVersion":"candidate-source-v1","taskId":"TEST_FIXTURE_TASK_001","executionId":"TEST_FIXTURE_EXECUTION_001","sourceId":"ebb44e0c32c3f182accfeb93e80c9a4ae386d062842e5f075a2815deeeaa8e58","sourceUrl":"https://example.com/test-fixture/synthetic-price-signal?b=2&a=1","canonicalUrl":"https://example.com/test-fixture/synthetic-price-signal?a=1&b=2","sourcePlatform":"example_fixture","pageTitle":"TEST_FIXTURE synthetic price signal","sellerName":null,"productTitle":"Synthetic product","price":50,"currency":"TRY","country":"TR","city":null,"searchQuery":null,"acquisitionMethod":"manual_seed","discoveredAt":"2026-07-18T00:00:00.000Z","acquisitionStatus":"acquired","legalBasis":"public_source","robotsPolicy":"allowed","errorCode":null,"fixtureMetadata":{"marker":"TEST_FIXTURE","isTestFixture":true,"productionEligible":false,"scenario":"synthetic_signal"}}]
